event01_34_05.bytes,,Llo,,
index,chara,jp,en,
40,,"宿に戻って大浴場に向かうと、
白い湯気と温泉の香りが私たちを出迎えてくれた。","As we came back to the inn and headed towards the spring area, we were greeted with white steam and the scent of the hot spring.",
44,Miyuki (Casual),はー……疲れた身体に、湯がしみるよぅ。,Haaah... The hot water is seeping into my exhausted muscles...,
46,Rena (Casual),お客さんって、レナたちだけかな？　かな？,"I wonder if we're the only customers here, customers here?",
50,Satoko (Casual),"こんなに広いお風呂を私たちだけで独占なんて、
贅沢な話ですわねぇ。",For us to have this huge bath all to ourselves is quite the luxury.,
54,Nao (Casual),そうね……ほわぁ、気持ちいい……。,"Definitely... aaah, it feels so nice...",
57,,"菜央ちゃんがお湯に肩までつかりながら、
緩んだ表情を見せる。","As Nao-chan sunk shoulder-deep into the hot water, she put on a relaxed expression.",
61,Mion (Casual),んー、やっぱり温泉っていいねぇ～！,"Mmm, hot springs really are it, huh~?",
63,Hanyuu (Casual),あぅあぅ、疲れが溶けていくようなのですよ……。,"Au au, it's like my exhaustion is melting away...",
67,Rika (Casual),"羽入の顔もとろけているのです。
……そういえば美雪、さっき赤坂と
何を話していたのですか？","Even Hanyuu's face looks like it's melting.
...By the way, Miyuki, what were you talking about with Akasaka earlier?",
71,Miyuki (Casual),"おと……赤坂さん、お風呂に行く前に
東京へ電話をかけてくるんだって。",My da-... Akasaka-san took a call from Tokyo before coming to the spring.,
73,Miyuki (Casual),"お風呂をあがったら、仕事の話とかを
聞かせてくれるって約束してくれたけど……
ちょっとだけ時間をくれってさ。",He promised me that we would talk about work after I got out of the spring... but he told me to give him some time.,
77,Satoko (Casual),"お電話って、お仕事ですの？
こんなところに来てまで、大変ですわねぇ。","Was the call because of work?
Coming all the way to this place must have been rough.",
79,Miyuki (Casual),いや、家に電話をかけてるだけだと思うよ。,"Nah, I think it was just a call from home.",
83,Kazuho (Casual),な……なるほど。,I... I see.,
86,,"今頃、自宅に電話して奥さんと娘さん……
５歳の美雪ちゃんとお喋りをしているのだろうか。","Around now... I wonder if he's chatting with his wife and his daughter, the 5-year-old Miyuki-chan?",
87,,"その微笑ましい光景を、お湯に浸かりながら
ほわほわと頭の中に思い描いていると……。",I was leisurely soaking in the hot water imagining that pleasant scenario when...,
90,戦人,全然駄目だぜッ！,It's all useless!,
94,Hanyuu (Casual),あぅ？　これは……隣の男湯からですか？,Au? Was that... from the men's side of the spring?,
96,Rena (Casual),……戦人さんの声かな？　かな？,"...Is that maybe Battler-san's voice, Battler-san's voice?",
100,戦人,やっぱりおっぱいは、まな板よりデカいのがいいだろ？！,"If we're talking about boobies, aren't massive bazoingas better than mosquito bites?!",
108,Rena (Casual),はぅっ……？！,Hauuu...?!,
113,圭一 (Casual),"確かに、それは否定しねぇ！
いや、できる男なんざ存在しねぇ！
男はみんなおっぱいが大好きだからなっ！","I'm definitely not gonna deny that! No, not a single man is capable of denying it! Every single man on earth {i}loves{/i} boobies!",
116,Satoko (Casual),……こっちは圭一さんの声ですわね。,...That's Keiichi-san's voice.,
118,圭一 (Casual),"大きいおっぱいが素晴らしいのは当然だ！
世界が認める真理だ！　出発点だ！","It's only natural that big boobs are splendiferous! 
It's the truth our world accepts! It's the foundation behind all foundations!",
120,圭一 (Casual),……けど、貧乳には貧乳のよさがある！,"...But still, there's value in having small breasts too!",
121,圭一 (Casual),"胸から腰にかけて、足のラインが
一直線で繋がるあのライン……！
あれは貧乳だからこそ持ち得る美点だと俺は思う！","From the chest, down to the waist, and even all the way down to the legs, it perfectly goes down in a straight line...! I believe that's a beauty that you can only behold with the unendowed!",
122,戦人,"なるほど、ミクロな視点じゃなくて
マクロな視点で見てるってぇわけか。
なかなか悪くねぇ……！","Gotcha. You're focusing on the big picture, not just a small bit of it. Not bad at all...!",
124,圭一 (Casual),"そうだ！　あと、将来性も見逃せない！
現在の完成形を愛でるのもいいが、
成長を逐一見届けることで愛着もさらにドン！","Exactly! And plus, you can't overlook the future either! 
It's good to cherish their current form too, but watching them gradually form up over time will get you even more attached!",
126,圭一 (Casual),"おっぱいソムリエだったら、
貴腐ワインだけでなくヌーヴォーの熟成を
期待するのもこだわりってものじゃねぇか？！","If boobs were a wine and you were a wine connoisseur, wouldn't you be fastidious over how your Boobjolais Nouveau ages, and not just your Caboobnet Sauvignon?!?!",
127,戦人,"いっひっひっひ！　さすが圭一！
やっぱりお前は、俺が見込んだだけの逸材だぜッ！","Ihihihi! Atta boy, Keiichi! That’s the prodigy I've been counting on!",
128,戦人,"となると……つまりだ。
これからは今ここにあるおっぱいだけじゃねぇ、
未来のおっぱいにも目を向けるべきだと……！","So, really... it all comes down to this.
From here on out, not only should we check boobies out as they are now, but we should continue observing them grow as time goes on...!",
129,圭一 (Casual),そうだぜ！　例えば、貧乳と言えば――。,"You got it! So for example, if we're talkin' itty bitty titties--...",
136,Kazuho (Casual),わっ？！,Aaahh?!,
141,,"ぱしゃ、と音がして耳元が塞がれる。
振り返ると、……表情の消えた美雪ちゃんが
私の後ろに回り込んでいた。","I heard something shifting towards me in the water.
I looked over... and saw Miyuki-chan moved over behind me with a blank expression.",
145,Miyuki (Casual),"……聞かない方がいいよ、一穂。
なんか、話が過激になってきたからさ。","It's better if you don't listen in, Kazuho. The conversation's kinda getting extreme.",
147,Kazuho (Casual),えっ……あの、その……？,"Eh... uh, um...?",
150,,"どういう意味なのかはわからなかったけど、
神妙なその口調に逆らうのはまずいと思って
とりあえず言う通りにする。","I have no idea what she meant, but I feel going against that mysterious tone of voice might be bad, so I'll just listen to her for now.",
151,,"そのおかげで、前原くんたちの声は
聞こえなくなったけど……近くの子たちの声は
普通に聞き取れることができた。","Because of that, I started to hear Maebara-kun and Battler-san's voices less... and was able to make out the girls' voices instead.",
157,Mion (Casual),け、圭ちゃん……。,K-Kei-chan...,
161,Rena (Casual),は、はぅぅ……。,H-Hauu...,
164,,"魅音さんとレナさんの顔が、
みるみる真っ赤に染まっていく。",Mion-san and Rena-san's faces turned bright red right away.,
167,Kazuho (Casual),な、何の話をしてるの……？,W-What kind of conversation are they having...?,
172,Satoko (Casual),……知らない方がいいですわ。,...It'd be better if you didn't know.,
174,Rika (Casual),みー、一穂には刺激が強すぎるのですよ。,Meep. It would be too stimulating for Kazuho.,
178,Hanyuu (Casual),せ、せめて声を小さく……あぅあぅ……。,Th-they should keep their voices down at least... au au...,
184,Nao (Casual),……男って馬鹿しかいないの？,...Are all men this dumb?,
186,Miyuki (Casual),"んー、そうかそうか……
前原くんたちって、私たちのことを
そんな目で見てたんだ～……へぇ……。","Mmm, I see, I see... Maebara-kun and Battler-san were looking at us with those eyes of theirs~... Interesting...",
188,Miyuki (Casual),"……みたいな気持ちなんだけど、
これはどうしたらいいと思う？","...They want to take a peek, but what do you think we should do about that?",
192,Satoko (Casual),"言いたいことはわかりますわ。
私も、今すぐ手元の風呂桶をありったけ男湯に
投げ込んでやりたい気分ですもの。","I know what you want to say.
I'm also in the mood to fill my bathing bucket as high as possible and toss it into the mens' side this very moment.",
196,Hanyuu (Casual),ほ、他のお客さんに当たったら危険なのですよ！,"I-If other customers tried doing that, it would be really dangerous!",
198,Satoko (Casual),だから、我慢をしているのでしてよ？,So do we just try to endure it then?,
204,Mion (Casual),"……とりあえず、男風呂の会話は
聞かなかったことにしよう。","...In any event, let's just pretend we didn't hear that locker room talk.",
207,Miyuki (Casual),"そうだね……。
もし私たちのところにまで聞こえてたと知ったら
前原くん、きっと合わせる顔がなくなるだろうね。","Yeah...
If Maebara-kun knew that we could hear everything from our spot, he'd lose all desire to make eye contact with us without a doubt.",
211,Rena (Casual),"はぅ……もしわざと聞かせてるんだとしたら、
どうすればいいのかな？　かな？","Hau... what could we possibly do if he was making it so we could hear them on purpose, on purpose?",
216,Hanyuu (Casual),そ、それはそれでタチが悪いのですよ……！,Th-that would be way too vicious...!,
220,Nao (Casual),打ち首獄門ね。,Electric chair.,
224,Satoko (Casual),市中引きずり回しの刑ですわ。,We'd drag them up and down town as punishment.,
228,Rika (Casual),"みー。
お馬さんでぱかぱか、ずるずるなのですよ。",Meep. Mr. Horsie goes clippity clap and they go slippity slide!,
232,Kazuho (Casual),それ、西部劇が入ってるんじゃ……？,Was that a Western movie reference...?,
236,Nao (Casual),"これが俺流のコミュニケーションだ、とか
抜かす阿呆には、こちら流の仁義と仕置きを
叩き込んでやるべきね。","We should meet their gross, idiotic masculine talk with our righteous feminine justice.",
244,Mion (Casual),"……ここにいる全員に言っておくよ。
もしあの２人に胸を揉まれそうになったら、
顔面にこぶし叩き込んでやりな。連打も可だから。","...I say this for everyone here.
If either of those two start trying to grope at your chest, you drive your fist right into their face. A few times, if you like.",
251,？？？？,おーっ！！,Yeaaaahhh!!!,
252,,"男湯で２人の気持ちがひとつになった反動で、
女湯チームの結束が固まっていった……
実に攻撃的な方向に。",The womens' side uniting together in reaction to the feelings of the mens' side is... taking an aggressive turn.,
255,Kazuho (Casual),"（よ、よくわかんないけど……
なんとなく前原くんは当分、部活に
参加できないような気がしてきたよ……）","(I-I'm not too sure about this...
But I'm getting the feeling that Maebara-kun won't be able to participate in club activities for a while...)",
260,Kazuho (Casual),"そ、それにしても……
他のお客さんって、全然入ってこないね。","A-Anyways...
You aren't getting any other customers here, huh?",
262,Mion (Casual),"プレオープン中だから、
そもそも泊まり客がそこまでいないんだよ。
日帰り客は、明るいうちに入っていくしね。","We're still in the pre-opening phase, so we don't have enough guests staying here for that to happen in the first place. Day trippers only come when it's bright out, y'know?",
264,Kazuho (Casual),"そっか……あれ？
だったら、戦人さんのいとこさんは？","Oh, okay... Huh?
If that's true, then where's Battler-san's cousin?",
268,Miyuki (Casual),"こことは別に宿泊施設にも温泉があるだろうから、
そこの部屋風呂とかに入ってるんじゃない？","There's a lodging facility here too apart from the hot spring, so shouldn't there be personal bathing area?",
272,Mion (Casual),"いや、宿泊施設自体はある程度完成したけど……
部屋風呂付きの別棟はまだ工事中なんだよ。","Well, the lodging facility itself is basically complete... but the outhouse where the bathing area would be is still under construction.",
274,Kazuho (Casual),"じゃあ、もう少し待って大浴場に来てくれたら
会えるかな……？",Then I wonder if we'd be able to meet her here at the hot spring if we wait a bit longer...?,
276,Mion (Casual),"どうかなぁ……昼間に入りに来たってことは、
明日の朝、入りに来るかもしれないしさ。","Who knows... she could have went in earlier today, or she could even go in tomorrow morning.",
278,Kazuho (Casual),"そっか……ところで、私たちって
まだ朱志香さんって人と会ってないけど、
どんな人かな？","I see... By the way, we still haven't met this Jessica-san, but I wonder what kind of person she is?",
280,Mion (Casual),"戦人さんからは、お嬢様らしくないお嬢様って
聞いたけど……孤島をまるまる所持しているって、
すごい家のお嬢様だよね。",I heard from Battler-san that she's a rich girl who doesn't act like a rich girl... but she's the daughter of a super rich family that privately owns an entire island.,
282,Kazuho (Casual),（園崎家も、十分すごいと思うけど……）,"(The Sonozaki family is super rich in its own right, though...)",
284,Mion (Casual),"まぁ、うちとしても取引先のお嬢さんだったら
挨拶くらいはしておきたいところだね。","Well, if it's the daughter of our business partner, I would at least want to greet her.",
286,Kazuho (Casual),……そうだね。,...Yeah.,
294,,"……温泉施設から出てきた頃には、
みんなの顔から疲労がすっかりと
取れている感じだった。","...By the time we left the hot spring facility, everyone's faces gave off the impression that our fatigue had been completely washed away.",
298,Mion (Casual),"んー、いいお湯だった！
やっぱりここに来ると、
全身が生き返った感じがするよ～！","Mmm, what a great bath! Your body really will feel like you've been reborn after coming here~!",
308,Rena (Casual),はぅ～、お肌つるつるだよ～！,"Hau~, our skin is so smooth~!",
310,Rika (Casual),"……みー、レナ。ボクたちの肌をなで回して、
温泉の美肌効果を実感しないで欲しいのですよ。","...Meep, Rena. Please don't rub the hot spring's beautifying effects on our skin into oblivion.",
312,Hanyuu (Casual),"あ、あぅあぅあぅ！
これ以上もちもちされたら、ほっぺが
取れてしまうのですよ～！","A-Auauau! If we turned any more doughy, our cheeks would slide off~!",
314,Rika (Casual),"美肌マッサージにしては
刺激が強すぎるのです、みー。","The stimulation from getting massaged is way too powerful, meep.",
321,Miyuki (Casual),"……その歳で肌に気を遣うのは、
ちょっち早い気がするけどねー。","...I feel like it's a smidge fast to be worrying about skin at that age, though.",
323,Nao (Casual),"でも、肌のケアは若いうちから
やっておくに越したことはないそうだし……
あんたにも教えてあげましょうか？",But there's nothing better than taking care of your skin from a young age... Do you want me to teach you how?,
325,Miyuki (Casual),"んー、いいよ。
沙都子たちの方が興味ありそうだから、
そっちを優先してあげて。","Mmm, nope!
Satoko and the others look pretty interested in it, though, so go for them instead.",
329,Satoko (Casual),"あらっ、それはありがたいですわね。
次に来た時はぜひ、菜央さんから
ご教示をいただきたいですわ～♪","My, I'd love to hear about it. Next time we come here, I would very much like to be instructed by Nao-san~♪",
334,Kazuho (Casual),"うん、また来たいね。
……次は、女の子だけで。","Yeah, I wanna come again.
...Just with the girls next time.",
336,Kazuho (Casual),"（そうじゃないと、本当に前原くんが
市中引きずり回しの刑に処されそう……）","(If not, they may seriously drag Maebara-kun around town as punishment...)",
338,,"そんな未来は阻止しなきゃ……！
なんて決意を固めたその時、ふわり、と
隣の男湯の暖簾が動く。そして――。","As soon as I had the determination to think, ""I have to prevent that future from happening...!"", the curtain over on the mens' side moved lightly. And then--",
343,戦人,いやぁ～、いい湯だったな！,"Haha~, that was a sweet bath!",
345,圭一 (Casual),"いや、まったく！
戦人とは、また裸で語らいたいぜ！","Man, you said it! We gotta talk about nudity again sometime!",
351,Mion (Casual),"……。男２人は、なんかこう別の意味で
サッパリした顔で出てきたね。",...Those two have a refreshed look on their faces as if that meant something else.,
354,Rena (Casual),"は、はぅ……魅ぃちゃん、
言い方にトゲがあるんじゃないかな……かな？","H-Hauu... Mii-chan, was there maybe an edge to your wording... your wording?",
358,Rika (Casual),"みー、圭一にはしばらくの間
警戒が必要なのですよ。",Meep. Keiichi needs to watch his step for a bit.,
362,Kazuho (Casual),えっ……？　な、なんで？,Huh...? W-Why?,
366,Nao (Casual),はい、あんたは首をつっこまない。,"Yeah, better not get involved.",
372,圭一 (Casual),"おっ、女湯のみんなはもう出ていたんだな。
んで魅音、これからどうするんだ？","Oh, the girls already got out of their bath. So, Mion, what are we doing now?",
374,Mion (Casual),宿でご飯。あとは適当にのんびり……かな？,Dinner at the inn. Afterwards we can properly relax... I guess?,
378,戦人,お、いいな！,"Aight, nice!",
380,圭一 (Casual),旅館の飯かぁ、ワクワクするぜ！,"A traditional Japanese inn-style meal, huh? I'm psyched!",
384,Satoko (Casual),では、その後は恒例の枕投げですの？,"And after that, we have our customary pillow fight?",
388,Nao (Casual),食べた直後の運動は、ちょっと……。,Physical activity right after eating is... kind of...,
392,Mion (Casual),んじゃ、軽く休憩した後に枕投げってことで。,Then we'll pillow fight after a short rest.,
396,Hanyuu (Casual),あぅあぅ、楽しみなのですよ～！,"Au au, I'm looking forward to it~!",
398,Mion (Casual),"あ、そうだ。戦人さん、いとこさんって
先に宿でくつろいでいるんですよね？
よかったらその前に、ご挨拶を――。","Ah, that's right. Battler-san, before we relax at the inn, your cousin, right? If you'd like, we could go greet her before--",
403,赤坂,……あっ、右代宮くん！,"...Ah, Ushiromiya-kun!",
409,戦人,えっ……？,Huh...?,
415,,"その時、こちらに向かってすごい勢いで
走ってくる、切羽詰まったような顔をした
その人は――。","In that moment, a person making a face as if he was at wit's end appeared while running towards us, saying--",
419,赤坂,"みんなも一緒か……ちょうどよかった！
女湯に、右代宮朱志香さんはいたかい？！","Everyone's here together... perfect timing!
Was Jessica Ushiromiya-san in the womens' side of the spring?!",
422,Miyuki (Casual),えっ？　いえ、私たちだけでしたけど……。,"Huh? No, it was just us...",
424,赤坂,そうか……だとしたら、どこに……？,"Really... If so, then where is she...?",
428,戦人,あの、赤坂さん。どうかしたんですか？,"Uh, Akasaka-san, what's going on?",
432,赤坂,"……右代宮くん、落ち着いて聞いてくれ。
いとこの朱志香さんが、この時間になっても
部屋に戻っていないらしい。","...Ushiromiya-kun, listen carefully and calmly.
Your cousin Jessica-san hasn't returned to her room all this time.",
435,戦人,なっ……？,Wha-...?!,
437,赤坂,"宿の人が、夕飯のことで相談しようと
何度も部屋に電話したそうなんだが、
誰も出なくて困っているみたいなんだよ。","The inn people tried calling her repeatedly to inform her about dinner, but no one answered, so we believe something might be up.",
442,Rena (Casual),"はぅ……もしかしたら、散歩に
行っているんじゃないんですか？",Hau... What if she's just out on a walk?,
444,赤坂,それなら、いいんだけど……。,That would be nice if true...,
447,,"そう言って、赤坂さんは口ごもる。
……その表情を見て、梨花ちゃんは
神妙な顔で彼に向き直っていった。","After saying that, Akasaka-san hesitated.
...Seeing that expression, Rika-chan turned towards him with a mysterious look.",
451,Rika (Casual),"……赤坂。もしかしてあなたは、
朱志香が「例の連中」と接触した可能性を
考えているのですか？","...Akasaka, are you perhaps considering the possibility that Jessica has come into contact with ""them""?",
454,赤坂,"うん。もちろん、そうでないことを
祈りたいんだけど……。","Yeah. Of course, I'm hoping that that isn't what we're dealing with, though...",
458,圭一 (Casual),"でも、赤坂さん。この辺りにいるやつは
俺たちであらかた刈り尽くしたはずだから、
さすがに心配しすぎじゃないですか？","But, Akasaka-san, we've picked off the majority of them around this area, so maybe you're a little overworried?",
462,Mion (Casual),"……いや、そうも限らないよ。
あいつらって、どこからどう現れるか
いまだにわからないしね。","...No, he's right. We still don't know where they might pop up at any point.",
467,Kazuho (Casual),と、とにかく……手分けして探そうよ！,A-Anyways... let's split up and search for her!,
473,,"私たちは、そこまで広くはない
温泉街を手分けして、探し回った。","We split up around the not-too-huge hot spring district, looking around for her.",
477,,"でも……待ち合わせ場所の温泉街の入口に
全員が集まっても、誰も朱志香さんを
連れてくることができなかった……。","But... even after we'd all regrouped at our designated meeting space at the entrance to the hot spring district, no one was able to bring Jessica-san back with them...",
481,Satoko (Casual),……はぁ、どこにもおりませんわね。,"...*sigh*, she does have to be somewhere.",
483,戦人,"もしかして、朱志香のやつ……
温泉街を出たのか？",Don't tell me Jessica... left the hot spring district?,
487,Nao (Casual),"……かもね。
でも、だとしたらどこに行ったのかしら？","...She might have. But if so, where would she have gone?",
491,Rena (Casual),"はぅ……徒歩だったら、そう遠くには
行っていないと思うけど……。","Hau... If she went on a walk, I feel like she wouldn't be very far...",
495,Hanyuu (Casual),"ここから村の中心地まで一本道なので、
そっちに向かった可能性も考えられるのですよ。","This road leads directly to the heart of the village, so the possibility of her going there could also be considered.",
499,圭一 (Casual),"けど、いくら小さな村といっても
人ひとりを探すには広すぎないか？","But no matter how small the village is, isn't it too big to look for a single person?",
503,Nao (Casual),しかも夜だから、見通しが悪い……。,"And plus, it's nighttime too, so it'll be hard to see...",
511,Kazuho (Casual),"で、でもそれなら、早く見つけないと！
迷子になったら、大変だよ……！","B-But that's all the more reason to find her as soon as possible!
It would be terrible if she ended up a missing person...!",
519,Rika (Casual),"……落ち着くのですよ、一穂。
今、早く見つける方法を探そうと
しているのです。","...Calm down, Kazuho. We're considering the fastest way to find her.",
521,赤坂,うーん……どうしたものかな。,Mmm... I wonder what we should do.,
527,Mion (Casual),どう、沙都子。何か思いつくことはない？,"How about you, Satoko? Anything come to mind?",
529,Satoko (Casual),"……申し訳ありませんが、
朱志香さんという方を存じませんので
行動パターンが読めませんわ。","...I deeply apologize, but since I'm not familiar with this Jessica-san, I won't be able to read her behavioral patterns.",
535,圭一 (Casual),"だったら、効率が悪くても
人海戦術が一番確実か……？","So then, even if it's not efficient, isn't throwing people at the problem the best way...?",
