537,戦人,"でも人手なんて、
ここにいる全員が精一杯だろ？",But hasn't everyone here been giving it their all to no avail?,
542,Mion (Casual),"あ、そっちは任せてください。
どこかで電話を借りて、村の連中を……。","Ah, please leave that part to me. If I can pick up a phone somewhere, I can get the village people to...",
545,Mion (Casual),……って、あれ？,"...Wait, huh?",
551,,"そこへ、車のライトが私たちを照らしてくる。
ゆっくりと坂を上ってきた車が停車し、
運転席の窓が開くと……。","Over beyond, the headlights of a car shine on us. The car slowly comes up the hill and stops next to us, and as the driver window rolls down...",
552,,そっと顔を出してきたのは、入江先生だった。,It revealed a gentle-faced person sitting in the car... Doctor Irie.,
556,入江,"おや、みなさんこんにちは。
こんなところで会うなんて、奇遇ですね。","Oh, hello, everyone. What a coincidence to meet in these parts, huh?",
560,戦人,"……あっ！　あんた、俺たちを
ここに送ってくれたお医者さんだよな？",...Ah! Are you the doctor that drove us here?,
563,Rika (Casual),みー。入江と知り合いなのですか？,Meep. Are you familiar with Irie?,
565,戦人,"#p興宮#sおきのみや#r駅でここまで来る交通手段がなくて、
困ってたところを送ってもらったんだよ。","We were in a rut since there was no way of getting here from Okinomiya Station, so he gave us a ride.",
569,入江,"ところで、どうかされたのですか？
皆さんなんだか、深刻そうな顔をされていますが。","Speaking of that, has something happened? Everyone has such grave-looking expressions.",
573,赤坂,"あの、入江先生。#p雛見沢#sひなみざわ#rからこちらに
来られたということは……途中で女の子、右代宮くんと
一緒にいた朱志香さんを見かけませんでしたか？","Uh, Doctor Irie, on the way here, could you have caught sight of the girl that you drove here with Ushiromiya-kun? Jessica-san?",
575,入江,"朱志香さん、ですか……？
彼女は今頃、詩音さんの案内で古手神社の高台に
行っているはずですが。","Jessica-san, is it...? Around now, she should be getting shown around the Furude shrine grounds by Shion-san.",
579,戦人,"詩音……って、俺たちを送ってくれた時に
一緒に車に乗ってた、長い髪の子ですよね？","Shion... the long-haired girl that was in the car with us when you picked us up, right?",
583,Mion (Casual),"えっ……？
戦人さん、詩音と知り合いだったの？","Huh...?
Battler-san, you know Shion?",
585,戦人,"あ、あぁ。聞くタイミングを失ってたけど、
そこの魅音ちゃんとそっくりな女の子で……。","Ah, yeah. I never had the time to mention it, but she looks just like Mion-chan...",
589,Nao (Casual),まぁ、双子だものね。,"Well, they {i}are{/i} twins.",
591,戦人,"あ……そういえば、俺が助手席で
入江先生と話してる間に、後部座席で
２人が何か話してたような……。","Ah... that reminds me. While I was talking to Doctor Irie in the front seat, those two were talking about something in the back...",
595,入江,"それって……「高台から見下ろす
雛見沢の夜景は素敵ですよー！」とか、
詩音さんに勧められていた時のことですか？","That was when Shion-san was giving the recommendation... ""Looking down on Hinamizawa from the high ground is a wonderful sight!"", right?",
599,Satoko (Casual),"だとしたら朱志香さんは、
詩音さんと一緒に高台に……？","So then, Jessica-san is with Shion-san at the shrine grounds...?",
602,,"温泉であったまった全員の身体から、
さぁっ、と血の気が引いていく。","Everyone's blood ran cold, even after all that time in the hot spring.",slight rewording
605,圭一 (Casual),"……おい。神社のあたりって
今日駆除に回った範囲の外……だよな？",...Hey. The area around the shrine wasn't in the range of our extermination rounds today... was it?,
613,Mion (Casual),あ……あんの馬鹿詩音っ！！,Th-... that dumbass Shion!!,
621,Rena (Casual),"と、とにかく急ごう！
朱志香さんが『ツクヤミ』と遭遇する前に！","A-Anyways, let's hurry before Jessica-san comes into contact with {b}Tsukuyami{/b}!",
623,Rika (Casual),みー、古手神社に急ぐのですよ！,"Meep, let's hurry to the Furude shrine!",
627,Kazuho (Casual),う、うん！,O-Okay!,
635,,"私たちは、監督の車と温泉街に駐まっていた
タクシーに分乗し、急いで古手神社に向かった。","We hurried towards the Furude shrine, going separately in the Coach's car and a taxi from the hot spring district.",
636,,とはいえ、車で神社までは行けない。,"Be that as it may, we can't take a car into the shrine.",
641,,私たちは息を切らして、階段を駆け上がり……。,We breathlessly sped up the steps...,
645,,"たどり着いた高台で、２人の少女……と、
葛西さんを見つけた。","Once we reached the high grounds, we spotted two girls... there with Kasai-san.",
652,戦人,朱志香！　ここにいたのか？！,Jessica! You were over here?!,
657,,"その声に、詩音さんの隣にいた
私よりちょっと年上の女の子が振り返る。","The girl next to Shion-san, who didn't look much older than me, turned her head back in response.",
660,朱志香,おぅ、遅かったな戦人！,"Yo! You're late, Battler!",
665,詩音 (Casual),"お姉たちじゃないですか。
どうしたんです、そんな息を切らして。",If it isn't Sis and friends. Why are you all out of breath?,
667,葛西,大丈夫ですか？,Are you all alright?,
673,朱志香,……って、一緒にいる連中は？,"...Wait, did you all come here in a group?",
675,Kazuho (Casual),"あ、は、はじめまして……
私たちは、この雛見沢で暮らしてる者で……。","Ah, n-nice to meet you...
We're from Hinamizawa...",
678,,"走り通しで酸欠気味の頭で
自己紹介しながら、周囲を見渡す。","As I introduce myself while my head is still rushing from the lack of oxygen, I survey my surroundings.",
679,,"思った以上……と言うか、
のんびりした空気が流れている。
ちょっと肩透かしを食らった気分だ。","Before I realized it... the atmosphere gave off a laid-back feel.
I felt kind of disappointed.",
682,朱志香,"ちょっと状況がわからないんだけど……
私は右代宮朱志香です。よろしく！",I kinda don't get the situation... but I'm Jessica Ushiromiya! Pleased to meet!,
685,戦人,"挨拶の前に、お前なぁ……
宿からいなくなるんだったら、せめて
どこに行くかって誰かに伝言でもしていけよ。","Greet them earlier, damn it...
If you're gonna disappear from the inn, at the very least let someone know where you're heading off to.",
687,戦人,"おかげでみんな、大慌てだったんだぞ？
まったくお前は……！","Thanks to you, everyone was in a mad rush, y'know? Sometimes with you...!",
689,朱志香,あーん？？？　お前何言ってんだぜ？,Huuuh??? What are you even saying?,
691,朱志香,"駅から温泉街まで連れていってもらった時、
「古手神社の高台から見下ろす夜景は
素晴らしいですよー」って教えてもらったじゃねぇか。","While we were being brought to the hot spring district from the station, didn't she tell us, ""Looking down on Hinamizawa from the Furude shrine high ground is a wonderful sight!""?",
693,朱志香,"夜に迎えに来てくれるっていうから
お言葉に甘えて、見に行こうぜー……って話、
お前やっぱり忘れてたなー？","I'm guessing you forgot our conversation where we said, ""Let's go see it."", and I took your word for it when you said, ""I'll come over when night hits.""?",
698,赤坂,……そんな話があったのかい？,...That conversation happened?,
703,戦人,えっ、いやっ、……そんな話……！,"Oh, yeah... that conversation...!",
706,朱志香,"したからなっ！　待ち合わせ時間になっても
来なかったのは戦人じゃねぇか！！","Yes, that one! The one who didn't make it in time is you, Battler!!",
708,朱志香,"で、わざわざ車で迎えに来てくれた詩音さんたちを
待たせるのは申し訳ないから、私だけ来たんだよ！","And it would have been a burden to make Shion-san and Kasai-san wait after coming all the way over to get me, so I went without you!",
714,詩音 (Casual),"葛西のことなら、気にしなくてもいいって
言ったんですけどねぇ。",Though I did mention that Kasai wouldn't mind much.,
716,葛西,"……詩音さんはもう少し、
お気遣いがあってもいいかと。","...Shion-san, it'd be nice if you had a little more consideration for me.",
719,,"詩音さんと葛西さんのジョークが、
聞こえるけどよくわからない。","We could hear Shion-san and Kasai-san's joke, but it went over our heads.",
720,,"そして、私たちの視線も意識も、
全て戦人さんに集中して……。","So, we all focused our gazes and attention on Battler-san...",
724,Rena (Casual),戦人さん……？,Battler-san...?,
726,戦人,"いや……そういや、そんな話を
聞いたことがあったような……？","No... It's just, I swear I've never heard that conversation before...?",
730,朱志香,"うぜーぜ！　お前も「見に行こうぜ」って
言ってたからな？！","Shut up! You said, ""Let's go see it."", too, didn't you?!",
732,戦人,…………。,............,
735,,戦人さんがきゅっ、と口を閉じる。,"{i}Boop{/i}, Battler-san closed his mouth.","kind of struggling figuring out how to put this onomatopoeia in english without being like ""schooop"" or something"
738,Mion (Casual),"もしかして、適当に頷いて話を合わせたけど
ころっとそれを忘れてた……とか、そんなオチ？",So maybe you were lazily nodding your head along with the conversation and letting what was being said completely slip by...?,
743,Miyuki (Casual),"……おぅ。うちの社宅で男女間の
喧嘩ランキング上位に入るやつだ。",...Oof. This guy'd rank high in the mens' battle against women back at police housing.,
745,Nao (Casual),"適当に頷いて忘れる男と、
覚えてるだろうと思った女の対立……。","The man that lazily ignores what's being said, pitted against the girl that thought he was listening...",
751,戦人,"わ、悪かったって！
温泉街でのドタバタのせいで、
記憶から抜け落ちちまってたんだよ！",I-I said my bad! The panic at the hot spring district ejected any memory I had of that out of my head!,
754,Satoko (Casual),……戦人さぁん？,...Battler-saan?,
758,,"場の空気が剣呑なものへと変わり、
みんなの冷たい視線が戦人さんに向けられる。",The atmosphere turned menacing as everyone fixed their cold gazes on Battler-san.,
761,赤坂,"つまり、単なる記憶違いで
特に問題はなかったんだね……よかった。","So, this was essentially all caused by a simple slip of the mind, and nothing was actually wrong... Thank goodness.",
763,,"……それでも、赤坂さんの一言によって
場の空気がふっ、と落ち着いた気がした。","...But because of Akasaka-san's one comment, {i}poof{/i}, you could feel the atmosphere chill down again.",
768,戦人,あ、赤坂さぁん！,A-Akasaka-saaan!,
770,赤坂,"よかったじゃないか、誰も怪我がなくて。
少しひやりとさせられたのは確かだけど
杞憂で済んで、本当によかったよ。","It really is a relief that no one's hurt.
I clearly got a bit freaked out back there, but thankfully that was all baseless worry.",
774,Miyuki (Casual),そ……それもそうですね。,"Y-... yeah, true.",
778,圭一 (Casual),"そ、そうだな……一時はどうなるかと
思ったけど、何事もなかったみたいだし
それが一番だな！","Y-Yeah... I didn't know what was gonna happen for a minute, but it's awesome that it turned out to be nothing after all!",
782,Rika (Casual),"終わりよければ、と言うやつなのですよ。
にぱー。",All's well that ends well. Nipah~.,
786,Hanyuu (Casual),あぅあぅ、大事にならなくてよかったのですよ。,"Au au, I'm glad it was nothing major.",
792,朱志香,はぁ？　いったい何の心配してたんだよ。,Huh? What were you so worried about?,
794,戦人,いや、それは……。,"Well, you see...",
797,,"まさか『ツクヤミ』に襲われてたのでは、
とも言えず、戦人さんが言葉を濁して口ごもる。","Battler-san was beating around the bush, hesitating from bringing up the fact he was attacked by {b}Tsukuyami{/b}.",
798,,"そんな２人を見て、詩音さんが
くすっと笑みをこぼした。","Seeing those two, Shion-san couldn't help but let out a giggle.",
802,詩音 (Casual),"くっくっくっ……戦人さんって、
物忘れが多い方みたいですね。",*cackle*cackle*cackle*... Battler-san seems pretty airheaded.,
804,詩音 (Casual),"気をつけましょうね。そんなことじゃ、
約束事をうっかり破ったりして大切な相手に
悲しい思いをさせたりするかも、ですよ。",Let's tread carefully. Our precious friend that carelessly breaks his promises might get sad if we keep that up.,
806,戦人,そ、そこまで酷くはねーよ……たぶん……。,I-It's not thaaat bad... probably...,
810,Rika (Casual),みー。目が泳いでいるのですよ。,Meep. His eyes are darting around.,
812,戦人,"こ、これだけ暗いんだから
目がどう動いてるかなんて見えねぇだろうが！","I-It's probably because no matter how my eyes move, it's too dark to see!",
816,Mion (Casual),……苦しい言い訳だねぇ。,...What a painful excuse.,
820,Nao (Casual),まぁまぁ、何事もなかったし……。,"Alright, alright, nothing happened, so...",
824,,"……なんてことを話し合いながら、
とりあえず戻る準備をしようとした――
その時だった。","...We were getting ready to head back at this point of the conversation.
It was then that it happened.",
828,縁寿,"危ないっ、行ったわよ！
気をつけて！","Look out! They're coming!
Brace yourselves!",
833,？？？？,ギィイイィイイイイイ！！！,Giiiiiiiiiiiiiiiiiiiiii!!!,
839,Kazuho (Casual),えっ？,Huh?,
844,,"叫び声とともに、草むらから飛び出た
『ツクヤミ』を前にして、
一瞬頭が……真っ白に染まる。","Paired with that screaming voice, {b}Tsukuyami{/b} came bursting out from the grassy area in front of us... instantly turning my mind blank.",
848,Nao (Casual),なっ……！　このタイミングで？！,Wha-...?! Why now?!,
850,朱志香,えっ……えっ？,H-... huh?,
854,Miyuki (Casual),あー……これはまずい！,Aah... this is bad!,
858,Rena (Casual),みんな、無防備な朱志香さんを守って！,"Everyone, defend Jessica-san!",
866,戦人,くそっ！　朱志香、動くんじゃねぇぞッ？！,"Shit! Jessica, don't move from that spot, alright?!",
871,？？？？,ギィイイィイイイイイ！！！,Giiiiiiiiiiiiiiiiiiiiii!!!,
877,朱志香,へっ……あ、おい……？！,"Wh-... ah, hey...?!",
886,縁寿,"っ……隠れて見守ってたつもりだったのに、
私のところにまでバケモノが来るなんてね……！","Gh... I was just planning on hiding and watching over them, but to think those monsters would come to the spot I was at...!",
888,縁寿,"どうしよう？　あの子たちの言ってた内容だと、
素手でどうにかできる相手じゃなさそうだし……
って、えっ？","What should I do? Just like those kids said, you probably can't go against them barehanded... Wait, huh?",
890,縁寿,"これって『ロールカード』……？
いったいなんで、私の手にこれが……？！","Is this a {b}Role Card{/b}...?
How did this end up in my hands...?!",
895,？？？？,グァァァァアアァァッッッ！！,GROOOOOOOOOHHHHHHHHH!!!,
898,縁寿,"……どうやら、考えてる余裕もなさそうね。
これだけの数があっちの群れに加勢すると、
お兄ちゃんたちが面倒なことになるかもだし……！","...Apparently I'm not gonna have much room to think either.
If these ones make it over there as reinforcements, it'd be a load of trouble for Onii-chan and his friends...!",
901,縁寿,"いいわ……相手してあげる。
右代宮家の生き残りの力とプライド、
とくとその目でご覧なさいッッ！","Fine... I'll tango for a bit.
I'll burn the strength and pride of the sole survivor of the Ushiromiya family right into your eyes!!!",