368,,"　ヱリカさんが誰かと示し合わせる。その示し合わせた誰かが、紗
音さんに、何らかの指示を与える。","Erika-san is conspiring with someone. And that ""someone"" she's conspiring with has been giving instructions to Shannon-san somehow.",trying so hard not to say it idk if this makes it obvious or notnjdfghdfjg
369,,例えば……、そう、コスプレ撮影！,Like for example... yeah! Cosplay photography!,
370,,"　撮影の為に、ちょっとショッキングな準備がしてあるから、見て
も驚かないように、なんて風に予め言われていたとしたら……。","If you're cosplaying as something scary, you'd want to tell your photographer in advance so that he doesn't get shocked...",
373,Nao (Casual),"……あの魔法陣のシーツも、……紗音さんにとっては、事件性のな
い、プライベートなものとなる！","...This same thought applies to the magic circle sheets, which Shannon-san thought was a normal, harmless thing!",
375,,"　だが……、紗音さんに命令を出せそうな人物はかなり該当が多
い。",The thing is... Shannon-san is the type to listen to orders.,not totally accurate but better i think
376,,"　右代宮家の人間は全員そうだろうし、使用人頭や目上の使用人も
命令は可能だろう。",I'm led to believe the whole family is like that. You could probably give orders to the servant head and the older servants as well.,shes so mean i swear
377,,"　でも、……今はこれで十分。
　これで、紗音さんがあの魔法陣を見ても、何事もなかったかのよ
うに振舞う可能性が見えてくる……！","But... that's just it. Even if Shannon-san did see the magic circle, I can see her acting as if nothing had happened...!",is it my job to revise the japanese wording to make this sound more exciting
381,朱志香,……何か、ウチの使用人がやらかしたりした……？,...Did one of our servants mess up somehow......?,
383,Nao (Casual),いえ、そんなことはありません。むしろ、多分、逆です。,"No, not at all. It might be the opposite in fact.",
386,,"　紗音さんは、命令された通りに、使用人の仕事を全うしたに過ぎ
ないのだ。",Shannon-san simply carried out her orders as she was told.,
390,朱志香,じゃ、じゃあ、私はこれで失礼するぜ……！,"Th-then, I'll head out for now...!",
393,Nao (Casual),"ありがとうございました。本当に何でもないので、気にしないで下
さいね。","Thank you very much for that. Nothing really happened, so please don't worry.",
397,,"　朱志香さんが立ち去るのを見届け、振り返ると、
東屋のヱリカさんと目が合う……。","After making sure Jessica-san was gone, I turned around... and made eye contact with Erika-san by the arbor...",
404,ヱリカ,…………ふふん。,............*giggle*.,
409,,"　あの顔は、何を朱志香さんと話していたのか、全てお見通しだと
言いたいのだろう。",That face probably wants to say that she eavesdropped fully on whatever I was talking about with Jessica-san.,
410,,"　ヱリカさんは器用にも、魅音さんと談笑しながら、にもかかわら
ず、あたしをずっと監視していたのだ。","While Erika-san was having a friendly chat with Mion-san, she observed me the whole time without so much as a hint of effort.",
417,Nao (Casual),あれ、詩音さんは？,Huh? Where'd Shion-san go?,
419,Mion (ウェディング),"ちょっと別の小道具を探しに、ゲストハウスに戻ってるよ。すぐ戻
るよ。",She went back to the guesthouse to check for a different prop. She'll be back soon.,
423,ヱリカ,"……それにしても魅音さんは、……なかなかの切れ者じゃないです
か。","...At any rate, Mion-san... you can be pretty shrewd, can't you?",
425,ヱリカ,"こういっては失礼ですけど、怖い物知らずのただの田舎者かと思っ
ていたら、……なかなかです。","Saying this is a smidge rude, but I thought you would be like a caveman afraid of fire... You're pretty good, though.",
428,Mion (ウェディング),あっはっは！　ヱリカさんにそこまで言われると照れちゃうよぉ。,"Ahaha! If you say that much, I'll start blushing!!",
430,Mion (ウェディング),"でも、ヱリカさんだってなかなかだよ～？　でもひとつ勘違いがあ
るかなぁ。","But you're pretty good too, y'know, Erika-san? There's one thing you might have wrong, though~.",
433,Mion (ウェディング),"真実は暴くものじゃない。作るものなのさ。さもなきゃ埋めるもの
かな？　園崎家の次期頭首を、舐めてもらっちゃあ困るねぇ？","The truth isn't something you reveal, it's a fabrication of reality. Or maybe it's a mixture of the two? Either way, don't mess with the next head of the Sonozaki family, you hear?",
436,,"　……朱志香さんと話している間に、二人でどんな会話をしていた
か知らないが、……何だかバチバチしたものだったようだ。",...I don't know what those two were having a conversation about while I was talking to Jessica-san... but it feels like it was kind of fiery.,
437,,"　でも、仮にそうだったにせよ、魅音さんにとっては、やるねぇの
一言で済んでしまう程度なのだろう。","Even if that did happen though, Mion-san would probably just be like, ""You ain't half bad!"", and walk it off.",
441,ヱリカ,"魅音さん。約束しましょう。いずれ必ず。#p雛見沢#sひなみざわ#rに探偵として訪れ
ることをお約束します。","Mion-san, let's make a promise. One of these days, I'll definitely visit Hinamizawa as a detective.",
444,Mion (ウェディング),"うん！　きっとだよ！　部活メンバー全員で大歓迎しちゃうから
ね～！","Yeah, for sure! All of the club members will give you a warm welcome when you do~!",
447,,"　バチバチっと二人の交差する視線が火花を散らした気がしたが、
気の置けない仲だからこそのじゃれ合いにも見えてしまう。","Those fiery, murderous sparks that I felt in between them as their gazes met suddenly seemed like the kind in a friendly playfight.",
448,,"　やっぱり魅音さんという人は、場数が違うというか、度胸が半端
ないというか。……大物だ。","Mion-san either has more experience than me, or she just has way more guts than I do. ...She really is no joke.","bakazu could mean ""has been to a bunch of places"" but that's sooo wordy"
451,Nao (Casual),あ、……詩音さん、帰ってきました。,Ah... Shion-san came back.,
457,詩音 (ビキニアーマー),"お姉ぇ！　全然、違う場所に入れてありましたよ？　勘弁して下さ
いよねぇ！",Sis! I think I might have put it in a totally different place? Please forgive meee!,
459,Mion (ウェディング),"はぁ？！　出発前に入れる場所を勝手に変えたのはあんたで
しょー？！",Huuuh?! Weren't you the one who went and put it someplace else before we left?!,
464,ヱリカ,やれやれ。また賑やかになりました……。,"My, my. It's getting lively again...",
467,嘉音,……ご歓談中、失礼致します。お昼の準備が整いました。,...Please do forgive me for intruding on your conversation. Lunch has been prepared.,
469,ヱリカ,だそうですよ、皆様方？　参りましょうか。菜央ちゃま？,"Isn't that right, everyone? Shall we go now, Nao-chama?",
473,Nao (Casual),……ヱリカさん。あなたのアリバイ、崩せました。,"...Erika-san, I've torn your alibi to pieces.",
475,ヱリカ,おや。それは、食後のデザートに取っておきませんか？,Oh? Would that have been after dessert was served to us?,
477,Nao (Casual),いいえ、オードブルで。今、説明するわ。,"No, during appetizers. It's clear to me now.",
479,ヱリカ,"それ、ちゃんとコースになるんですよねぇ？　前菜で終わったら恥
ずかしいですよぉ？","Wouldn't the full-course meals have already come out if that were the case? It would have been embarrassing for me if I made it after appetizers were already over, don't you knooow?!",
481,Nao (Casual),"あなたは、紗音さんが異常を認めなかったから、犯行の余地はそれ
以降だとしていました。",You had Shannon-san look the other way from the point you committed the crime onward.,
483,Nao (Casual),"その上、ご丁寧に、紗音さんとあなたは示し合わせていないとまで
言い切ってくれました。でも","Moreover, you carefully asserted to me that you weren't conspiring with Shannon-san up until now. But--",
486,ヱリカ,#ff0000私と紗音さんは、示し合わせてなどいません。#r,{umi_red}Shannon-san and I are not conspiring together in any way.{/umi_red},
492,ヱリカ,"#ff0000私が何らかの人物を介し、もしくは手段を介して、紗音さんに根回#r
#ff0000しをした事実はありません。#r","{umi_red}Through another person or by any other means possible, it is in no way true that Shannon-san was involved behind the scenes.{/umi_red}",
494,Nao (Casual),………え………。,...Eh......?,
497,ヱリカ,"はぁぁぁ。残念無念、期待外れの的外れ。……ほらね？　デザート
にしておけばよかったんです。","*sigh*. Regrettably, you missed the mark by a longshot. ...See? It would have been better for me to do it during dessert.",Ughhh -> Sigh
499,ヱリカ,"直接示し合わせていないなら、誰かを挟んで間接的に示し合わせれ
ばいい、これで赤き真実の間隙を縫った！って、……思ったんで
しょお……？","Since I wasn't directly conspiring with someone, I must have been getting someone involved indirectly. You really thought you could weasel yourself through the red truth like that... huuuuh?!",
501,Nao (Casual),……ん、…………ぅ………。,...Nn...... uh......,
506,Nao (Casual),"お、……思ってないわよ。そんな下らない言葉遊び、……あたしを
子供扱いしないで欲しいわ。",I... I wasn't thinking like that. I don't want to be treated like a child with some... silly wordplay like that.,
509,ヱリカ,くっくっくっく……。グッド。,*cackle*cackle*cackle*cackle*... <Good>.,
511,ヱリカ,"探偵であれ、犯人であれ。……すぐに挫けるのは二流です。泣いて
うずくまるのは戦人です。",As the detective or as the culprit ...quickly losing heart is for second-rates. The only person who would keel over crying is Battler.,trying so hard not to say poors here
513,ヱリカ,一流は、タフでなければ。そして不敵でなければ。,"First-rates must be tough, and they {i}must{/i} be daring.",
516,,"　本当に嫌な人だけれど、不思議な人。
　ただの嫌な人というより、……何というか、……ライバルって感
じ。","She really is a hateable person; however, she's a bit strange. Rather than just being a hateable person... how can I put it... she's more like a rival.",
517,,"　小馬鹿にしたり、挑発したり。腹立たしいけれど、敵であれ、見
事ならば褒めるというところに、それを感じる。","She puts me below her and gets under my skin. She's aggravating, but as an enemy, I feel like she's deserving of praise in that aspect.",
522,Mion (ウェディング),"ほらほら、お昼に行こうよ～！　なぁにぃ？　ウチの菜央ちゃん、
口説いてんのぉ？","C'mon, c'mooon, let's go get luuunch~! Huuuuuuh? You hittin' on my little Nao-chaaaan?!",
524,ヱリカ,"えぇ、そうです。こんな可愛らしくて小憎らしい子、殺人事件の被
害者になる前に保護してあげないと。","Yes, absolutely. This sweet {i}darling{/i} of a girl must be protected at all costs before she becomes victim to a murder incident.",
526,Mion (ウェディング),"お～っと、お触りは厳禁ですよ～？　ウチの菜央ちゃんに御用の際
は、マネージャーを通してもらわないとぉ♪","Ooohhh, don't you know touching her is forbidden~? If you wanna schedule with my Nao-chan, you're gonna have to get through her manager fiiirst!♪",
528,ヱリカ,それで？　貴女方の手番は十分ですか？,And so? Will that be your move?,
531,Mion (ウェディング),もちろん、ターンエンド。あんたに次の手、期待してるよ～？,"Of course. Round over. Your next move better be promising, yeah~?",
534,,"　やっぱり、すっごいバチバチしてる。
　しかし、二人とも敵意を剥き出しのはずなのに、まるで映画の中
の出来事のような、カッコよさも兼ね備えている。","Yeah, there are definitely sparks flying between those two. But even though there's supposed to be enmity between them, it's almost like they've combined that with the coolness of a movie scene.",wording probs
535,,……これが、一流はタフでなければ、ということなのね……。,...This must be what it's like to be tough like a first-rate......,
539,詩音 (ビキニアーマー),菜央さん。昨夜は、あの悪戯、すっごいビックリしましたよねぇ？,"Nao-san, last night, didn't you get super shocked from that prank?",
541,Nao (Casual),え？　あ、はい……。,"Eh? Ah, yeah...",
543,詩音 (ビキニアーマー),あれが魔女の仕業だというのなら。,If that was the work of a witch...,
545,詩音 (ビキニアーマー),……こっちは、オヤシロさまの#p祟#sたた#rりがあるかもしれませんねぇ？,"...Oyashiro-sama's curse might be able to exist too, right?",
548,,え、……何？　どういう意味なの………？,Uh... what? What does that mean......?,
549,,"　詩音さんの笑みは、頼もしさが９割と、……１割の不敵さ、不気
味さが含まれている気がした……。","Shion-san's smile was about 90% reliable... and 10% daring, with a bit of creepiness mixed in...",
