event01_30_04.bytes,,danpmss,Lloro - QC/TL,Naegles - QC2
index,chara,jp,en,Notes
33,,"　あたしのベッドは毛布が剥ぎ取られ、……剥き出しのシーツに
は、鮮血のような赤で記された魔法陣があった……。",The blankets on my bed had been stripped off... and a blood-red magic circle could be seen painted on the sheets underneath.,
34,,"　ベアトリーチェが、……その存在を信じないあたしのベッド
に……、描いたんだ……。",Beatrice... an existence I don't believe in... drew this on my bed.,"from ""Beatrice... that existence in which I don't believe... drawn this in my bed."
38,,"　あぁ、やはり六軒島は、魔女の島だったんだ。
　島に住まう人たちが恐れていた存在に対し、敬いを持たなかった
から、……祟られたのだ。","Ah, in the end, Rokkenjima was indeed a witch's island.
Cursed... by its human inhabitants' lack of respect towards the being they dreaded.",
39,,どうしてこんなことに……。どうして…………。,Why did it have to be like this...? Why...?,
40,,…………………………。,...........................,
42,,"　……落ち着いて。考えて。
　ほら。……みんな、話していたじゃないか。","...Calm down. Think this over.
C'mon... we talked about that, right?",
43,,"　……ベアトリーチェの話？
　違う。……ミステリーと、オカルトの話だ。","...Was it the topic regarding Beatrice?
No... it was the talk about mystery and the occult.","NOTE: Flashback sequence ahead, must check coherence with the previously translated lines."
50,詩音 (Casual),"確かに一理ありますね。解決できればミステリーだけれど、解決で
きないなら、オカルトになることもありえる。","That's true. When you're able to solve it, it's considered a mystery, but unresolved ones often become part of the occult.",Linked these three Shion and Mion lines to exact same ones in part 2 since it's a flashback scene. See D36-38
52,Mion (Casual),"太古の昔から、神の奇跡とされていたものが、次々に科学で解明さ
れたからね。","Since ancient times, things once assumed to be divine miracles have successfully been explained through science.","""           """
54,Mion (Casual),"神の奇跡は解明できない。イコール、解明できなければ神の奇跡と
も言えちゃう訳だ。","Divine miracles cannot be explained. The idea here being, whatever you can't explain gets written off as a divine miracle.","""           """
58,,"　……そうだ。魅音さんと詩音さんが話してたじゃないか。
　解明できなければ、奇跡、……いや、魔女になってしまう。","...That's right. Isn't it just like what Mion-san and Shion-san said?
If something cannot be explained, ""it"" becomes a miracle... or in this case, a witch.",
60,,"　だが。
　解明されれば、魔女じゃない。オカルトじゃない。ファンタジー
じゃない。","However...
If it can be explained, then there is no witch. No occult. No fantasy.",
61,,"　そしてあたしは言ったじゃないか。
　――科学とオカルトの、戦いなんですね。………と。","Didn't I also say it myself? 
""It's the battle between science and the occult, right?""",NOTE: Quotting a line from a previous chapter.
62,,あぁ、そしてヱリカさんは言ったんだ。,"Ah, then Erika-san said...","NOTE: Flashback sequence ahead, must check coherence with the previously translated lines."
67,ヱリカ,"そこは優雅に、ミステリー、バーサス、ファンタジーと言って頂き
たいです。","More gracefully put, it's <Mystery versus Fantasy>.",Link this to... (etc...)
70,,"　……まったく。どいつもこいつも『名探偵ワニャン』の話ばっか
り！","...Honestly, all of them, always with that ""Detective Wanyan"" nonsense!","NOTE: I think ""nonsense"" fits the bill well enough, in this context."
79,Nao (Casual),"あたしは『カネダ少年の事件簿』派なのよ！　ばっちゃの名にかけ
て、魔女なんか認めないわッ！！","I'm Team ""Kaneda Case Files"", all the way! In the name of my granny, I won't acknowledge any witches!","NOTE: A funny alteration of one of Kindaichi's catchphrases (「ジッチャンの名にかけて」) from ""The Kindaichi's Case Files"", substituting ""grandpa"" with ""granny"".
"
87,,"　その時ようやく、あたしの頭に掛かっていたもやが晴れる。
　すると、手を叩く音と、笑い声が……。","At that moment, the mental fog inside my head finally cleared.
That's when I heard the sound of hands clapping, paired with a laughing voice...",
90,Nao (Casual),……あたしのベッドのシーツに素敵な落書きをありがとう。,...Thanks for the lovely scribble on my bedsheets.,
92,Nao (Casual),"あんなものを見せつけられたら、並の人なら恐怖して引っ繰り返る
のかしら？　お生憎だわ。","Perhaps an ordinary person would freak out seeing something like that? Well, too bad for you.",
94,Nao (Casual),あたし、まだまだ子供だし、こう見えて反抗期の真っ最中なのよ。,"I may look like I'm still just a kid, but I'll have you know, I'm right in the middle of my rebellious phase!",
97,Nao (Casual),部屋は密室だったから、魔女にしか出来ない、不気味な悪戯！！,"Since my room was locked, this creepy prank could only have been done by a witch?!",
99,Nao (Casual),"これみよがしな密室トリック！　あたしはむしろ、余計にあなたを
信じないの！！",What a pretentious locked-room trick! All you did was make me more skeptical!! ,
102,Nao (Casual),あなたが“い”ると主張するなら、あたしは必ず逆を主張する！！,"If you are going to claim that you ""exist"", I'm going to claim the opposite without fail!!",
106,Nao (Casual),お前なんか“い”るものかッ、ベアトリーチェ！！！,"As if things like you ""exist"", Beatrice!!!",
113,ベアトリーチェ,ははははは、くっはははひゃひゃっひゃ！！　これはこれは！,"Hahahahaha, kkhhhahahhahaha!! My, my!",
115,ベアトリーチェ,"今年の誕生日には、何とも骨のありそうな客人が祝いに来てくれた
ものだ！",Quite the troublesome guest has come to bring me a present for my birthday this year!,"from ""What a backboned guest came to celebrate my birthday, this year!"
117,ベアトリーチェ,"まずは妾からの挨拶、楽しんでもらえて何よりだ！　そして妾に屈
し、跪かせて靴にキスをすることになろうぞ！","First and most importantly, you'll get to enjoy a greeting from me! Afterwards, I'll have you subdued, kneeling before me and kissing my shoes!",
120,ベアトリーチェ,"改めて名乗ろうぞ！　妾はこの島の主、黄金の魔女、ベアトリー
チェよ！！","Let us formally introduce ourselves! I am this island's master, the Golden Witch, Beatrice!!",
123,ベアトリーチェ,"そして明日は、妾の誕生日！　ハッピーバースデー！！　トゥー
ミー！！！","And tomorrow is my birthday! 
<Happy Birthday!!> <Tooooo meeeeee!!!>",
125,,"　肖像画の魔女は、ものすごいハイテンションでご機嫌だ。
　だからといって、こちらまでテンションを合わせては、相手の思
う壺。","The witch from the portrait was in a tremendously enthusiastic mood.
Nevertheless, matching up to said high spirits would be just what my opponent wished for.",
128,Nao (Casual),"あたしは鳳谷菜央。薔薇を眺めながら刺繍でもして優雅に過ごし
て、明後日には帰るの。","I'm Nao Houtani. I'm going to spend my time gracefully admiring the roses while doing embroidery, and then I'll go back home the day after tomorrow.",
130,Nao (Casual),"その素敵なバカンスの思い出に、あなたやら、あなたの誕生日が残
ることはわずかほどもないんだから！！","Neither you, nor your birthday have absolutely any chance of remaining in my memories of this lovely vacation!",
132,,"　……ここはどこだろう。あたしはいつの間にこんなところにいる
のだろう？",...Where am I? When did I even end up in this place?,
133,,"　そして、肖像画の魔女が、こうしてあたしを嘲笑っている。そん
なことあるものか、ありえない。","To make matters worse, the witch from the portrait is mocking me like this. Not a chance. Inconceivable.",
134,,"　あるか、ないかは、これからあたしが決める。
　ベアトリーチェが“い”るか、否か。","Whether she's there or not is something for me to settle from here on out. Does Beatrice ""exist"", or does she not?","from ""Whether she's there or not, from here on, that's something for me to settle. Whether Beatrice ""exists"", or not at all."
135,,"　あたしは、魔女を貫かんばかりに指さして、ありったけの声で吠
える。","I pointed at the witch as if I was piercing her, and yelled with all of my strength.",
142,Nao (Casual),決めるのはあなたの悪戯でも魔法でもないッ！！,The deciding factors are neither your tricks nor your magic!!,"from ""It's not your tricks and magic that decides!!"
147,,"　そして、魔女に宣戦を布告するその指を、あたしのこめかみに当
てる。","Then, in a declaration of war with the witch, I pointed my finger at my temple.","from ""Then, I placed the finger that declared a war on the witch on my own forehead"
151,Nao (Casual),"決めるのは、あたしだわッ！　あたしの頭が、あなたという未解明
を解明してみせる！！",The one who decides is me!! I'll take your mystery and unravel it with my very own mind!!,"from ""The one who decides is me!! My mind will unravel the mystery that is you!"
153,ベアトリーチェ,"くっくっく！　やはりこの感じはよい！　全身の血が泡立つかのよ
うな、興奮！　愉悦！　圧倒的高揚！！","*cackle*cackle*cackle*! This feeling is truly spectacular! This gets my blood {i}rushing{/i}!! Oh, what excitement! What pleasure! What an upsurge of emotion!!!",
156,,"　ここがどこで、どうして魔女とあたしが対峙しているのか、……
　細かいことなんか気にしない。",The questions of where I am and why I'm faced up against the witch right now... are trivial matters to me.,
157,,"　あたしが否定し、こいつは主張する。そして出会ってしまったな
ら、もう。","I'm the claimant, and she's the defendant. If we ended up this way, it is what it is.",
161,Nao (Casual),"あなたを、あなたの下らない悪戯をッ、解明してやる！！　ばっ
ちゃの名にかけて！！","I'm going to put an end to the mystery of your worthless pranks!! 
In the name of my granny!!!",
163,ベアトリーチェ,"ひゃっひゃひゃひゃひゃひゃ！！　ほざくがよい！
屈服させてやる！！　ばっちゃの名にかけて！",Hyaaahhhahahahaha!!! Spatter as much as you like! I'll make you surrender!! In the name of my granny!!!,
166,,あら。こいつ、カネダ少年の事件簿派だったの？,"Oh. Was she also... Team ""Kaneda Case Files""?",
170,ベアトリーチェ,"おお、そなたもカネダ少年派か！　この島の者はワニャン派が多く
てなぁ！","Ooh, you're Team Kaneda too?! This island has far too many people on Team Wanyan!",
172,Nao (Casual),……同じ派閥同士。正々堂々と戦いましょ。,...Comrade of mine. Let's fight fair and square.,im not sure what the original line translation for this is
174,ベアトリーチェ,"うむ！　さぁ、座るがよい、菜央！　久しぶりに楽しませてもらお
うぞッ！","Mhm! Now, sit where you please, Nao! It's been a long time since I've had this much fun!",
179,,あたしと魔女の間に椅子とテーブルが現れる。,"In between the witch and I, a table and chairs appeared.",
180,,"　テーブルの上には、チェス盤と駒が並べられているように見えた
が、どこか普通のチェスとは違うように見えた……。","On top of the table, pieces seemed to have been lined up on a chessboard, but in a way that wasn't like the usual chess setup...",
189,ベアトリーチェ,妾の初手は、そなたのベッドシーツに描いた魔法陣だ。,"For my first move, I've drawn a magic circle on your bedsheets.",
191,ベアトリーチェ,"鍵の掛かった密室だったであろう？　ならば、魔法陣が描けたのは
魔女の魔法に他ならぬわ……！","It would have been a locked room, wouldn't it? Then, the magic circle could only have been drawn with a witch's magic...!",
193,Nao (Casual),"なら、魔法陣は次から山羊の血か何かで描いた方が説得力が増すわ
よ。","Oh, really? Next time, drawing the circle with goat blood would make it a bit more convincing.",
195,Nao (Casual),"あのシーツの魔法陣は、すぐに悪戯だと見破ってくれたわ。魅音さ
んがね。","This magic circle prank has already been seen through, thanks to Mion-san.",
197,ベアトリーチェ,"ほう？　どうしてシーツだけで、妾が魔女であることを否定でき
る？","Hoh? Why is it that just through the sheets, you can deny my existence as a witch?",
199,Nao (Casual),"あれは水彩絵の具で描いたものだと、魅音さんは一瞬で看破した
わ。",Mion-san realized instantly that it was drawn with watercolor paint.,
201,Nao (Casual),"それとも、あなたの魔法はチープで血では描けないから、赤い絵の
具で魔法陣を描いた、とでもいうのかしら？","Actually, I wonder if you drew the magic circle with red paint {i}because{/i} your magic is too cheap to be able to draw in blood?",
204,,"　しかも、シーツには描かれていたが、その下のベッドには一切、
染みていなかった。","What's more, the paint hadn't even seeped past the sheets onto the bed.",
208,Nao (Casual),"あなたは屋敷の人に優しいわね。シーツだけ洗えば済むように、上
手に悪戯をしたのね？","You're pretty nice to the people in the mansion. You pulled this prank knowing the sheets could just be washed and re-set, didn't you?",
210,Nao (Casual),"つまり、犯人は予め、絵の具で魔法陣を描いたシーツを用意し、あ
たしのベッドシーツを剥いで、代わりにそれを敷いたのよ。","Which means that the culprit painted a magic circle onto some sheets beforehand, pulled off the sheets from my bed, then laid out the fake sheets in its place.",
213,ベアトリーチェ,"くっひっひっひ！　なるほどなるほど、確かに人間臭い悪戯である
なぁ。","*cackle*cackle*cackle*!! I see, I see. This prank has human spelled all over it, huh?",
215,ベアトリーチェ,"だが、敢えて言おう。妾が魔法陣を絵の具にて描いたのは、妾を敬
う使用人たちのことを思ってである。","Allow me to say this upfront, then. My magic paint circle was drawn with my faithful servants in mind.",
217,Nao (Casual),"……なるほど？　あなたのことを信じる紗音さんたち使用人に、あ
まり迷惑を掛けたくなかったと。",...I see? You didn't want to burden Shannon-san and the rest of the servants who believe in you.,
220,,それで、洗えば落とせる絵の具で魔法陣を？,"And just like that, it's just a magic circle that can wash off easily?",
224,Nao (Casual),お優しい魔女さまだことね。,What a kind witch you are.,
226,ベアトリーチェ,"魔法陣が絵の具で描かれていたとしても、妾が魔法にてそれを描い
たことを否定は出来ぬぞ？","Even with it having been drawn with paint, can you deny that I drew it with magic?",
228,ベアトリーチェ,"ニンゲンがどのようにして成し遂げたのか。その仮説を青き真実と
して妾の身に打ち込んで初めて、妾を否定するに至るのだ。",How would a Human be able to accomplish that? Only by beginning to launch hypotheses as blue truths into my body will you be able to deny me.,
230,Nao (Casual),…………？？　青き？　え？,.........?? Blue? What?,
232,ベアトリーチェ,"……あぁぁぁぁ。……戦人も、この辺りを理解するのに時間を掛け
たんだよなぁ……。",...Uugggghhhhhh. ...I had to take the time to explain this to Battler around this point too...,
234,ベアトリーチェ,"調子に乗って、あまりいじめると、こやつも戦人みたいにいじけて
塞ぎ込んでしまうからなぁ……？","If I get too carried away bullying her, would she get all depressed just like Battler did when I bullied him...?",
241,ドラノール,"その役目。ベアトリーチェ卿さえよければ、私がお引き受けしマ
ス。","If Lady Beatrice would like, I can take up that ROLE.",
246,ベアトリーチェ,"これはこれは……。久しいな、ドラノールよ！　大方、判子押しに
飽きて逃げ出してきたのであろう。くっくっく。","My, my... long time no see, Dlanor! I suppose you got tired of all of that stamping and fled here. *cackle*cackle*cackle*.",
248,Nao (Casual),だ、誰？,Wh-who's that?,
250,Nao (Casual),"まぁ、あたしは今、魔女と対峙してるのよ。今さら誰が現れたって
驚かないわ。","Well, I {i}am{/i} facing off with {i}Beatrice{/i} right now. Whoever else appears shouldn't be a surprise.",
254,ドラノール,菜央。私は味方デス。ドラノールと申しマス。,"Nao, I am your ALLY. Dlanor is my NAME.",
256,ドラノール,"今、貴女が臨んでいるのは、魔女のゲーム。ルールに則らねば、勝
つことは出来ないのデス。","What you are confronted with right now is the witch's GAME. If you don't follow the rules, winning will be IMPOSSIBLE.",
258,Nao (Casual),"ルール？　罰ゲームをかけた部活ボードゲームの次は、魔女とのゲ
ームなのね。退屈しないことだわ。","Rules? First it was club tabletops with punishment games, and now it's a witch's game. I hope this won't be too boring.",
260,ドラノール,菜央。貴女はヱリカの言葉を覚えているはずデス。,"Nao, you should remember Erika's WORDS.",
262,Nao (Casual),……ミステリー、バーサス、ファンタジー、だっけ？,"...<Mystery versus Fantasy>, right?",
264,ドラノール,"その通りデス。魔女の主張は、貴女のベッドへの魔法陣の悪戯は、
ニンゲンには不可能であるとしていマス。",EXACTLY. The witch's claim is that it would be impossible for a Human to perform the prank on your BED.,
266,Nao (Casual),"なるほど……。ニンゲンに不可能だから、魔法。魔女の仕業だと言
いたい訳ね。","I see... And since it's impossible for a Human, it's magic. She's trying to say it was done by a witch.",
271,ベアトリーチェ,"くっくっく。そなたが妾を魔女と認めず、魔法も認めぬというのな
らば、示さねばならぬ。","*cackle*cackle*cackle*. If you don't acknowledge me as a witch, nor acknowledge magic, you'll just have to show me yourself.",
273,ベアトリーチェ,ニンゲンに、どうやってあの魔法陣を描けたのかをなぁ！,Do tell how could a Human could have drawn that magic circle!,
277,ドラノール,"菜央。貴女は仮説を立てることが出来マス。ニンゲンが具体的にど
のようにすれば実行可能かを示すのデス。","Nao, you may set up a HYPOTHESIS. This should demonstrate how a Human could have executed this in a concrete WAY.",
282,ベアトリーチェ,"どのような屁理屈でも構わぬ。そしてその仮説が有効であるなら
ば、それは“青き真実”となる。","It doesn't matter how far-fetched the argument is. And if your hypothesis is valid, it will become a ""blue truth"".",
284,Nao (Casual),……青き真実……。,...Blue... truth......,
288,ドラノール,"青き真実を穿たれた魔女は、それを否定できなければ、敗北しマ
ス。","As the blue truth drills through the witch, she must disprove it or face DEFEAT.",
290,Nao (Casual),"つまりあたしは、あの魔法陣の悪戯を、人間がこれこれこうして実
行できたと、どんなデタラメでも言えばいい訳ね？","So, this means I can say whatever nonsense I want about how a human could have performed this magic circle prank?",
292,ドラノール,そうデス。デタラメで結構デス。真実でなくても構いまセン。,"That is CORRECT. Nonsense is FINE. Even if it's untrue, it does not MATTER.",
294,ドラノール,魔女のゲームは、魔女の存在を否定することのみが争点デス。,"In the witch's game, the objective is to deny the existence of the WITCH.",
296,ドラノール,"デタラメであっても、人間に可能な犯行であると仮説を立てられれ
ば、それで貴女の勝ちなのデス。","Even if it is nonsense, if you hypothesize a crime that is possible with human hands, that will end in your VICTORY.",
298,Nao (Casual),"了解したわ。……なるほど。屁理屈でも何でもいいから、人間にも
出来るわって言えればいい訳ね。","Understood. ...Okay. Since any kind of argument is fine, it is possible that a human did it, somehow.",
302,ベアトリーチェ,"そなたは呑み込みが早いなぁ……。後で爪の垢をほじらせてはくれ
ぬか。戦人用の茶葉に混ぜておくぞ。",You catch on quite fast... Will you let me dig out the dirt from under your nails afterwards? I'll mix it in with Battler's tea leaves!,why did she say this jdfjssdsj
304,Nao (Casual),"あの魔法陣の悪戯は人間に可能よ。あたしたちが不在の間に、部屋
にこっそり入って悪戯をすればいい。こんな感じ？","The magic circle prank could have been performed by a human. While we were absent, someone sneakily entered the room and was able to do the prank. Like that?",
306,ベアトリーチェ,"それでは成立せぬな。忘れたか、菜央よ。あの部屋は密室であった
のだぞ？","That is not a valid argument. Have you forgotten, Nao? That the room was locked?",
308,ベアトリーチェ,そなたらが夕食の為に部屋を出る時、施錠したはず。,"As you went out to have dinner, you locked the room.",
310,ベアトリーチェ,"それから就寝の為に部屋に戻って魔法陣を見付けるまで、部屋は密
室だったはずだ。","Until you retired to your room and found the magic circle, the room should have been locked.",
312,Nao (Casual),……じゃあ、こんな感じならどう？,"...How's this, then?",
320,Nao (Casual),"#4169e1施錠されていて密室だったけれど、マスターキーを持った人間なら#r
#4169e1入って悪戯をすることが可能だわ。#r","{umi_blue}Although it is a locked room, it is possible for a human with a master key to enter and perform the prank.{/umi_blue}",
328,Nao (Casual),どう？！,Did that work?!,
330,ベアトリーチェ,もう少し、具体的に言ってもらえると助かるぞ。,I would appreciate it if you were a bit more specific.,
332,ベアトリーチェ,マスターキーを持った、誰が可能だったというのか？,"For instance, {i}who{/i} could have possibly had the master key?",
334,Nao (Casual),じゃあ、もっと踏み込んで言うわ。,Then I'll say something more daring.,
337,Nao (Casual),"#4169e1使用人である紗音さんはマスターキーを持ってるわ。それで鍵を開#r
#4169e1けて部屋に入り、悪戯をしたのよ！#r","{umi_blue}The servant Shannon-san has a master key. Through that, she used the key to unlock the door, enter the room, and perform the prank!{/umi_blue}",
343,ベアトリーチェ,#ff0000紗音は、魔法陣を描く一切の行為に関わっていない！#r,{umi_red}Shannon was not involved in performing the act of drawing the magic circle!{/umi_red},
345,Nao (Casual),どうして……？！　その根拠は？！,But how...?! On what grounds?!,
349,ドラノール,菜央。これは赤き真実というものデス。,"Nao, this is the red TRUTH.",
351,ドラノール,"赤き真実で語られたことは、疑いなく真実なのデス。そして、その
根拠を示す必要もないのデス。",The red truth speaks of nothing but the undeniable TRUTH. The basis behind it has no need to be EXPLAINED.,
356,ベアトリーチェ,"くっくっく！　そういうことよ。赤き真実は、ただそれだけで真
実！",*cackle*cackle*cackle*! It's just as she says. The red truth is simply the truth!,
358,ベアトリーチェ,"どうしてそうなのか、なぜそうなのか。それらの一切を省き、ただ
ただ真実だけを示すのだ。","Why and how is it so? Looking past all of that, it simply shows the truth.",
363,Nao (Casual),……そんな……滅茶苦茶な………。,...That's... so unreasonable...,
365,ドラノール,"落ち着いて下サイ、菜央。……赤き真実は容赦のない反撃ではあり
ますが、同時に手掛かりにもなりマス。","Please calm yourself, NAO. ...The red truth may be a merciless counter attack, but it simultaneously gives clues as WELL.",
