367,Nao (Casual),"少なくとも、紗音さんは魔法陣を描いていない、という確実なヒン
トを引き出せた訳ね……。","Like how I was at least given the hint that Shannon-san didn't draw the magic circle, right...?",
369,ドラノール,"そういうことデス。貴女が青き真実を繰り出す度に、魔女は赤き真
実で反撃しマス。","Just as you SAY. As you send out more blue truths, the witch will retaliate with red TRUTHS.",
371,Nao (Casual),"それを積み重ねて……、密室に魔法陣が現れた事件の、真相を引っ
張り出せばいいのね。",Letting those pile up... the truth behind this magic circle locked-room incident will jut out further and further.,
376,ベアトリーチェ,"菜央ぉ、やっぱりお前の爪の垢、全部、ほじらせてくれよォ。戦人
に飲ませたいよォ。","Naooo, please do let me dig out the dirt from your naaaillss! Battler's going to love drinking iiiit!",she-
381,ドラノール,さぁ、菜央。これは貴女のゲームデス。自由に挑んで下サイ。,"Okay, NAO. This is your game NOW. Please challenge it to your LIKING.",
383,Nao (Casual),……わかったわ。ありがとう。,...Got it. Thanks.,
385,Nao (Casual),まずは状況を、簡単に整理してみるわ。,"First, let's try to get the conditions in order.",
388,,"　あたしたちは夕食に呼ばれて部屋を出るまで、ずっと室内で過ご
していた。
　当然、その時点ではあたしのベッドに異常はない。","We did not leave our room at all until we were called out for dinner. 
Of course, by that time, nothing was wrong with my bed.",
389,,そして部屋から出る時に施錠した。,"And when we did leave the room, we locked it.",
390,,"　夕食後、そのまま朱志香さんも加わって、ボードゲームで遊ん
だ。","After dinner, Jessica-san joined in, and we played a board game.",
391,,"　そして就寝する為に部屋に戻り、開錠。……そして、そこには魔
法陣が。","Then, when we went back to go to sleep, we unlocked the room. ...That's when we saw the magic circle.",
395,Nao (Casual),"普通に考えれば、あたしたちが夕食をしている間に行われた犯行だ
わ。","Thinking about it normally, the crime could have been done while we were having dinner.",
397,Nao (Casual),その間に部屋に入ったのは、……紗音さんのみ。,The only person who could have entered at that time... was Shannon-san.,
399,ドラノール,"窓の鍵を見て欲しいと貴女たちが頼み、紗音は２階に上がり、
マスターキーにて開錠して入室しマシタ。","When you requested her to check out the window lock, Shannon-san went up to the second floor and unlocked your room with the master KEY.",
401,Nao (Casual),そこで紗音さんは魔法陣の悪戯をする機会を得られる。,That's when Shannon-san gained the opportunity to perform the magic circle prank.,
403,Nao (Casual),ところが、今、ベアトリーチェは赤き真実で言ったわ。,"But as a matter of fact, Beatrice had said this in the red truth just earlier.",
406,Nao (Casual),#ff0000紗音さんは、魔法陣を描く一切の行為に関わっていない。#r,{umi_red}Shannon-san was not involved in performing the act of drawing the magic circle.{/umi_red},
408,Nao (Casual),ってね。,Right?,
411,,"　何だか、回りくどい言い方。
　じゃあ逆に言うなら、魔法陣を描かずに犯行を行なうことは出来
る……？","What a roundabout way of saying it. Another way of saying this, then, is that someone can perform the crime without drawing the magic circle...?",
417,Nao (Casual),"#4169e1紗音さんは、魔法陣は描いていないけれど、魔法陣の描いたシーツ#r
#4169e1を、あたしのベッドに敷くことは出来たわ。#r","{umi_blue}Shannon-san didn't draw the magic circle, but she could have laid the sheets with the magic circle on my bed.{/umi_blue}",
419,ドラノール,"有効デス。紗音には、予め何者かが用意した魔法陣のシーツを隠し
持って、入室することが可能デス。","This is VALID. It is possible that someone else could have prepared the magic circle sheets in hiding beforehand, while Shannon could have entered with THEM.",
427,ベアトリーチェ,"#ff0000紗音は、魔法陣のシーツを菜央のベッドに敷く行為には、直接的に#r
#ff0000も間接的にも一切、関わっていない！#r","{umi_red}Shannon was not involved in any way, directly or indirectly, in the act of laying the magic circle sheets on Nao's bed.{/umi_red}","I went with 
""#ff0000
Shannon was not involved in any way, directly or indirectly, in the act of laying 'the sheet with a magic circle' on Nao's bed.
#r""
at chapter 5, C91 (by Jevil)"
432,Nao (Casual),間接的というのは？,Indirectly?,
434,ベアトリーチェ,"魔法陣のシーツをベッドに敷く直接の行為だけでなく、そうとは知
らずに結果的にそうなってしまうようなあらゆる行為も含めて、と
いう意味だ。","This isn't just a matter of directly laying the magic circle sheets on the bed. This means it includes {i}any{/i} act that led to this result, even without knowing it.",
437,,"　つまり……。紗音さんが、知らず知らずの内に犯人に加担してし
まったということも、ないということだ。","So, this means... Shannon-san hasn't even cooperated with the culprit unknowingly.",
438,,例えばだが、犯人が、特殊なシーツを予め用意したとする。,"For example, though, the culprit could have prepared some unique sheets beforehand.",
439,,"　塗った時には透明だが、時間が経つと色が出てくるという絵の具
で魔法陣を描いたとする。だからそれは、傍目には普通のシーツ
だ。","But by the time the paint was on, it was transparent, so this magic circle could have been drawn with paint that fades in over time. In that sense, these sheets are just any old sheets.",
440,,"　紗音さんは普通の白いシーツを敷いたつもりでいるが、それが後
に、色が浮き出て、魔法陣のシーツになる、という善意の第三者の
形でも、関わっていないということだ。","Suppose Shannon-san entered in order to lay on some normal white sheets, but afterwards, the color set in, and they became the magic circle sheets. In this case, she as a third party could have done this in good faith, and she wouldn't have been involved at all.",
444,ベアトリーチェ,"そもそも、紗音はシーツを換えに部屋に行ったのではなかろう？　
窓の鍵を見に行っただけのはず。","Shannon probably didn't go to your room to change the sheets in the first place, though? She simply should have went in to check on the window lock.",
446,ドラノール,"紗音が２階にあがり、降りてくるまでの時間も、最低限の短いもの
デシタ。",The timeframe that Shannon went up to the second floor and came back down was as short as can BE.,
451,Nao (Casual),"……そうよね。普通に考えて、いくら彼女がベッドメイキングの達
人だとしても、あの短時間で行なえるとは思えないわ。","...That's right. Thinking about it regularly, no matter how much of an expert she is at bedmaking, it's unthinkable that it could have been done in such a short timeframe.",
453,Nao (Casual),"それに紗音さんは、あたしが窓の鍵の話を切り出すまでは、屋敷に
戻るつもりでいた。","Moreover, she even came back from the room as soon as we had broached the topic of the window lock.",
455,Nao (Casual),"２階に上がる機会を得たのはたまたまよ。そのたまたまの為に紗音
さんが、いつも魔法陣のシーツを隠し持っているなんて、現実的
じゃない。","It just so happened that going upstairs gave her that chance. It's unrealistic for Shannon-san to have had the magic circle sheets on her the entire time, just for that possibility.",
457,Nao (Casual),"……ベアトリーチェ。議論が紗音さんだけで迷走してるとつまらな
いでしょ？　そこをはっきりしてもらうわ。",...Beatrice. Wouldn't this be too boring if this argument was just about Shannon-san straying from us? Make this clear for me.,
461,ドラノール,そういう時は、復唱を要求するといいデス。私がやりまショウ。,"At times like this, you can have her repeat what you SAY. Allow me to try IT.",
463,ドラノール,"復唱要求。“紗音は、菜央たちが夕食の為に部屋を出てから、就寝
の為に戻るまでの間、一切のシーツに触れていナイ”。","Repeat it in RED. ""From the point the girls left the room to eat dinner to the point they returned, not once did Shannon touch the SHEETS.""",
466,ベアトリーチェ,よかろうぞ。復唱しよう。,Very well. I'll repeat it.,
471,ベアトリーチェ,"#ff0000紗音は、菜央たちが夕食の為に部屋を出てから、就寝の為に戻るま#r
#ff0000での間、一切のシーツに触れていない！#r","{umi_red}From the point the girls left the room to eat dinner to the point they returned, not once did Shannon touch the sheets.{/umi_red}",
476,Nao (Casual),ありがとう。これで推理を、別の方向に向けることが出来るわ。,Thanks. Now I can approach this from a different direction.,
478,Nao (Casual),"……紗音さんだけに囚われては駄目だわ。……他にも思考を巡らさ
なきゃ……。",...I can't just put the blame on Shannon-san. ...I need to think about it differently.,
483,ドラノール,……ベアトリーチェ卿もずいぶんと変わられたものデス。,...Lady Beatrice has also changed quite a LOT.,
485,ベアトリーチェ,言うな。戦人とのゲームだけは特別だったのだ。,"Oh, hush. Battler's game in particular was an exception.",
487,ベアトリーチェ,"あれは互いを苛む永遠の拷問であったが、今宵は違う。ただ、楽し
みたいのだ。",Tonight is nothing in comparison to the endless torture between him and I back then. I just wanted to have a little fun.,
489,ドラノール,"天界に帰る時。貴女も落ち着きある淑女になられたと、報告しま
ショウ。","When I return to Heaven, I must report that you have also been turned into a peaceful LADY.",
491,ベアトリーチェ,"くっくっく。我が名は永遠の淑女を意味するものであるぞ？　……
ただ、永遠は難しい。","*cackle*cackle*cackle*. Doesn't my name mean Eternal Lady? ...Well, ""Eternity"" is unpleasant, though.",
493,ベアトリーチェ,"妾も、淑女に疲れると、……まぁた、性質の悪い、地の性格が出て
しまうかもしれぬぞォ……？","If I get tired of ""Lady"" too... would it give rise to another hideously behaving person...?",$!?!!?!?14
497,Nao (Casual),えっと、復唱を要求。,"Umm, repeat this in red.",
499,Nao (Casual),"“ゲストハウスの２階へ上がる為には、必ず１階の広間の前を通ら
なければならない”。","""To get to the second floor of the guesthouse, you must absolutely pass through the front area of the first floor.""",
502,ベアトリーチェ,"くっくっく。言いたいことはわかっておるぞ。ならば、妾がより詳
細に言ってやろう。","*cackle*cackle*cackle*. I know what you're trying to say. Instead, I'll say something more specific.",
507,ベアトリーチェ,"#ff0000そなたたちが施錠してから、再び開錠するまでの間、紗音を除い#r
#ff0000て、ゲストハウス２階に訪れた者はいない。#r","{umi_red}No one visited the second floor of the guesthouse from the time you locked the door until you opened it again, except for Shannon.{/umi_red}",Chapter 5 D111
509,Nao (Casual),"……ありがとう。……ますますに人間の仕業とは思えなくなるけれ
ど、重要なヒントだわ。","...Thanks. ...I'm starting to think a human could do this less and less, but there is an important hint there.",
512,,"　マスターキーを持っているのは紗音さんだけではない。使用人な
らみんな持っているのだ。",Shannon-san is not the only one to have a master key. All servants have a master key.,
513,,"　紗音さんが窓の鍵を直してから退出した後、あたしたちは１階広
間でずっとボードゲームをしていた。","After Shannon-san went to fix the window lock, we had been there on the first floor playing a board game the whole time.",
514,,"　その間に、紗音さん以外のマスターキー保持者が、こっそりと２
階へ上がり、犯行に及んだ可能性だってあったのだ。","In that timeframe, there is a possibility that someone other than Shannon-san who had a master key could have sneakily went up to the second floor and committed the crime.",
518,Nao (Casual),"でも、あなたの赤き真実のお陰で、それら一切の可能性を除外でき
たわ。","But thanks to your red truth, all of those possibilities have been snuffed out.",
520,ベアトリーチェ,"夜は短いのでな。気前よく、今の赤き真実に、さらに情報を加えよ
う。",The night is short. Allow me to tack on some more red truths for you out of generosity.,
524,ベアトリーチェ,"#ff0000そなたたちが施錠してから、再び開錠するまでの間、紗音を除い#r
#ff0000て、ゲストハウス２階に訪れた者はいない。#r","{umi_red}No one visited the second floor of the guesthouse from the time you locked the door until you opened it again, except for Shannon.{/umi_red}",
530,ベアトリーチェ,"#ff0000これは階段で上がることのみを指さない。壁をよじ登ったり、空か#r
#ff0000らグライダーで訪れたり。あらゆる手段によるゲストハウス２階へ#r
#ff0000の到達を否定するものである。#r","{umi_red}Going upstairs through any other way than using the stairs, such as sawing through the walls or gliding in from the sky, is not permitted. Any other means of reaching the second floor can therefore be denied.{/umi_red}",
534,Nao (Casual),え、……それじゃ、窓の意味が………。,"Wha-... Then, that means going in from the window is...",
536,ベアトリーチェ,"くっくっくっく！　紗音が直すまで、窓の鍵は開いていた。そこよ
り何者かが侵入して犯行に及んだとするつもりだったのだろう？","*cackle*cackle*cackle*cackle*! Until Shannon fixed it, the window was unlocked. I suppose you thought someone broke into the guesthouse through there?",
538,Nao (Casual),図星よ……。犯人は外壁を登って、窓から入ったと思ってた……。,Bullseye... I thought the culprit climbed the wall and came in through the window...,
541,,"　最初は、デタラメでもいいから、人間に可能な犯罪であると屁理
屈を言い切れれば勝ち、くらいに思っていた。","At first, when they said nonsense was fine, I thought just saying any crime that was possible for a human would result in me winning.",
542,,ところが、……当たり前だが、魔女はこのゲームに#p慣#s・#r#pれ#s・#r#pて#s・#r#pい#s・#r#pる#s・#r。,"But despite that... of course, this game is something the witch is {i}accustomed to{/i}.",idk how to transcribe the furigana (nareteiru / used to)
545,Nao (Casual),……なるほど。……確かに、ヱリカさんの言う通りですね。,...I see. ...It actually is like Erika-san said.,
548,ドラノール,何がデスカ……？,What IS...?,
550,Nao (Casual),ミステリーには、肉体的な格闘技の一面もある、ってところです。,Mysteries have offensive and defensive components.,
552,Nao (Casual),"この魔女のゲーム。……あたしには勝利条件があるけれど、魔女側
にはないのが不思議でした。","In this witch's game... I have a winning condition, but the fact that the witch's side doesn't is strange.",
554,Nao (Casual),あたしは、人間に可能な犯行であることを示せれば、アガリ。,"If I demonstrate that the crime is possible for a human, I win.",
556,Nao (Casual),"しかし、魔女側には勝利条件がない。あたしがアガリになるまで、
相手をするだけ……。","However, the witch's side has no winning condition. Until I win, my opponent can only...",
559,,"　つまり、魔女が、いつ負けるかだけを競う、知恵の輪みたいな
ゲームだと思っていた。","Basically, this is a game of back and forth wits, where we just compete until the witch loses.",
560,,知恵の輪だって、……敗北はあるのだ。,But with back and forth wits... there are drawbacks.,
564,Nao (Casual),"推理を振り回され、混乱させられて、……あたしの頭が疲れ切っ
て、もうどうでもよくなってしまった時……。あたしは敗北するの
ね。",Amidst the chaos of throwing logic back and forth at each other... I might get tired and start feeling like I don't care about the end result... This is a drawback for me.,
566,ベアトリーチェ,そうだ。菜央。……そなたは本当に理解が早い。,"That's right, Nao. ...You really do understand fast.",
568,ベアトリーチェ,魔女のゲームの勝敗は、妾の側には何もない。,The outcome of this witch game offers nothing for my side.,
570,ベアトリーチェ,"勝利も、敗北も、全て、人間側の手の平の上にあるのだ。……くっ
くっくっく！","Win or lose, the human side has the upper hand. ...*cackle*cackle*!",
572,Nao (Casual),"……まずいわ。唯一、部屋に入った紗音さんは関わっていなくて、
その上、他の誰も２階に行っていないと断じられている。","...This is bad. Shannon-san wasn't involved when she entered, and on top of that, absolutely no one else even went up to the second floor.",
574,Nao (Casual),"一見、人間には無理な犯行に思えてくる。頭が疲れて、魔女を認め
たくなってくる。","At a glimpse, it feels like a crime impossible for a human. When I get tired out, I'll start wanting to acknowledge the witch.",
576,Nao (Casual),"でもね、あたしは負けず嫌いなのよ！　あたしは追い詰められてな
んかいない！",But I hate losing! I haven't been cornered at all!,
580,Nao (Casual),"あなたの赤き真実は、あたしの胸を貫く楔じゃない。ファンタジー
を楔為に越える崖に打ち込む、楔なのよ！！",Your red truths won't shoot through me. I'll launch over this precipice and wedge into the heart of fantasy!!,"huge improv, not sure if it works"
584,,"　あたしが負けを認めない限り絶対に負けない！　つまり、あたし
は絶対に勝てるんだ！",I certainly can't lose until I admit my defeat! This means I'm {i}certainly{/i} going to win!,
587,ドラノール,これは驚きマシタ。……なかなかの逸材デス。,How SURPRISING. ...You are incredibly GIFTED.,
591,ベアトリーチェ,"さてと。今宵は永遠の拷問ではなく、余興である。ゆえに、夜は短
い。","Now, this night isn't meant to be eternal torture, it's meant to be fun. Again, the night is short.",
593,ベアトリーチェ,"本来ならば、そなたが自ら屈服するまで、永遠にゲームの相手とさ
せてやりたいところだが……。","Originally, I would have wanted to force you to play against me eternally until you got bored; however...",
595,ベアトリーチェ,妾とのゲームには期限を切ろう。,Let's cut it off here for now.,
597,ベアトリーチェ,"そなたの滞在は、２泊３日であったな？　それまでに妾の悪戯を暴
いて見せよ。","Your stay is only two nights and three days long, isn't it? Until then, let's see if you can expose my pranks.",
602,Nao (Casual),"……負けたら罰ゲームでもあるの？　魔女だから、とてつもなくエ
グいのが。","...If I lose, is there a punishment game? You're a witch, so you could be extraordinarily gruesome with it.",
604,ベアトリーチェ,稀な客人との余興であるぞ。罰ゲームなどはない。,I am enjoying myself with a rare visitor. There will be no punishment games.,
606,ベアトリーチェ,むしろ逆で、妾を打ち破れたなら、褒美を取らそうではないか。,"Rather, if you can defeat me, why don't I bestow a gift upon you?",
608,Nao (Casual),いいわね。……やる気、出て来たわ。,I like that idea. ...That makes me wanna go at it more.,
615,Nao (Casual),……え？　何？　暗くなってきた。,...Huh? It's fading to black?,
620,ドラノール,それでは菜央。……また次の晩にお会いしまショウ。,"Goodbye, NAO. We shall meet in the next TWILIGHT.",
622,ベアトリーチェ,妾も楽しみにしておるぞ。くっくっくっく…………。,I'm also looking forward to this. *cackle*cackle*cackle*...,
